id,url,category_id,publisher_id,title,pubDate,description,content,tags,crawlDate
20191231102618576,http://cafef.vn/khong-the-pha-vo-nguong-khang-cu-bitcoin-ao-ao-lao-doc-20191231102618576.chn,6,1,"Không thể phá vỡ ngưỡng kháng cự, Bitcoin ào ào lao dốc",31-12-2019,"Bitcoin nhiều khả năng rơi xuống 6.000 USD sau nỗ lực phá vỡ ngưỡng kháng cự bất thành, kéo theo sự sụp đổ loạt tiền ảo hàng đầu, khiến sắc đỏ phủ kín thị trường.","Tăng trưởng ấn tượng 1,5% giá trị ngày đầu tuần không được duy trì, tín hiệu lạc quan từ các chỉ số kỹ thuật không giúp ""vua"" tiền ảo thăng hoa. Bitcoin đang trở lại thực trạng yếu ớt của mình với việc mất 1,75% giá trị trong sáng nay. Cụ thể, lúc 7h00, trên sàn Bitstamp, giá giao dịch mỗi Bitcoin ở mức 7.190 USD, giảm 136 USD so 24 giờ trước.Theo dữ liệu từ CoinMarketCap, trong thời gian trên, khối lượng Bitcoin giao dịch đạt 22,8 tỷ USD, tăng nhẹ gần 1 tỷ USD so với ngày liền trước. Trong khi vốn hoá thị trường giảm 2 tỷ USD, ghi nhận mức 132 tỷ USD.Giá Bitcoin lại tiếp tục giảm mạnh.    Ripple giảm 1,33% về 0,194 USD, vốn hoá đạt 8,4 tỷ USD, khối lượng giao dịch trong 24 giờ gần nhất là 1,23 tỷ USD.Tether giảm 0,1% xuống 1,01 USD, vốn hoá ghi nhận mức 4,1 tỷ USD.Litecoin và EOS cùng giảm 2% lần lượt ghi nhận mứv giá 42,6 USD và 2,64 USD.Bitcoin SV là tiền ảo giảm sâu nhất với 3,11% khiến giá giao dịch hiện chỉ còn 97 USD.Tuần trước, Bitcoin đóng cửa mức 7.380 USD. Mức giá thấp nhất trong tuần ghi nhận là 7.050 USD. Dù giá giao dịch đang trong kỳ ảm đạm nhưng nhiều nhà giao dịch chuyên nghiệp vẫn tỏ ra lạc quan do Bicoin chưa bị mất mốc 7.000 USD.Trong ngày giao dịch hôm qua, Bitcoin đã nhiều lần cố gắng vượt qua mức 7.500 USD, sau khi tăng 1,5% giá trị và chạm mốc 7.400 USD. Những nỗ lực không thành công đã khiến Bitcoin rơi vào suy giảm và về mức như hiện tại.Theo một số nhà phân tích thị trường, Bitcoin đang lặp lại mô hình đã thấy trong đầu tháng. Việc không thể phá vỡ ngưỡng 7.500 USD đã tạo cơ hội cho ""phe gấu"" kiểm soát thị trường và có thể đẩy giá về mức thấp 6.000 USD.Trong lịch sử 10 năm tồn tại của mình, Bitcoin có biến động mạnh về giá. Cuối 2017, giá tiền ảo này từng tiến sát 20.000 USD, sau đó mất giá tới 70% năm 2018. Đà hồi phục chỉ mới xuất hiện từ tháng 4 năm nay, kéo Bitcoin liên tiếp vượt các mốc giá quan trọng trong thời gian ngắn. Tuy nhiên, thời điểm hiện tại, Bitcoin đang liên tục lao dốc, có lúc xuống 6.500 USD.Tại Việt Nam, giá Bitcoin đang giao dịch mức 166 triệu đồng, giảm 0,9%.Thị trường phủ màu xanh, Bitcoin sắp bùng nổ?","ngưỡng kháng cự,khối lượng giao dịch",31-12-2019  00:00:00

20191231090322013,http://cafef.vn/bay-ra-dao-de-gap-mot-co-gai-nhung-bi-huy-chuyen-lien-thue-may-bay-khac-ban-ve-39-usd-chieu-roi-lap-hang-moi-canh-tranh-dieu-dien-ro-chi-richard-branson-moi-dam-lam-20191231090322013.chn,6,1,"Bay ra đảo để gặp một cô gái nhưng bị hủy chuyến liền thuê máy bay khác, bán vé 39 USD/chiều rồi lập hãng mới cạnh tranh, điều điên rồ chỉ Richard Branson mới dám làm!",31-12-2019,"Khi rơi vào tình cảnh chuyến bay đến quần đảo Virgin bị hủy, Branson đã nảy ra một ý tưởng kinh doanh vô cùng táo bạo, dẫn đến sự ra đời của hãng hàng không Virgin Atlantic năm 1984.","Hầu hết chúng ta đều cảm thấy bực tức và mệt mỏi với một chuyến bay bị hoãn. Và thậm chí còn tồi tệ hơn nữa khi chuyến bay đó bị hủy hoàn toàn. Tỷ phú người Anh, Richard Branson cũng cảm thấy như vậy nhưng khác ở chỗ thay vì chấp nhận như mọi người, vị doanh nhân liều lĩnh này đã quyết định thành lập hẳn một hãng hàng không!Vào đầu những năm 80, khi rơi vào tình cảnh chuyến bay từ Puerto Rico đến quần đảo Virgin bị hủy, Branson đã nảy ra một ý tưởng kinh doanh vô cùng táo bạo, dẫn đến sự ra đời của hãng hàng không Virgin Atlantic năm 1984.Thời điểm bị hủy chuyến, thay vì chờ chuyến tiếp theo, Branson đã thuê một chiếc máy bay, mượn một chiếc bảng đen và viết lên đó dòng chữ: ""Virgin Airlines, 39 USD một chiều đến quần đảo Virgin"". Sau này, ông cho biết lúc đó chỉ viết ""cho vui"" nhưng không ngờ cuối cùng lại gom đủ hành khách bị hủy chuyến ngày hôm đó và có chuyến bay đầu tiên của mình.Có tới 30 người đã đi về phía Branson, đưa cho ông thẻ tín dụng của họ để thanh toán tiền với hy vọng không phải chờ đợi thêm nữa. Khi đến nơi, một người nói với ông: ""Cải thiện dịch vụ thêm một chút là ông đã có thể tham gia kinh doanh trong ngành hàng không rồi đấy!"".Doanh nhân tỷ phú người Anh, Richard Branson.Khi bay đến quần đảo Virgin, Branson đã là một doanh nhân thành đạt sau khi thành lập hãng thu âm Virgin Records khá thành công từ vài năm trước. Được biết, ông dự định bay đến đó để gặp một ""cô gái đáng yêu"" tại hòn đảo tư nhân mang tên Necker của ông. Vậy mà American Airlines lại dội cho ông một gáo nước lạnh!Trong một cuộc phỏng vấn với CNBC, Branson chia sẻ: ""Tôi rất tức giận. Chúng tôi đã không được gặp nhau trong 3 tuần! Vậy mà họ lại hủy chuyến"". Không chỉ thuê máy bay và bán được chuyến bay thay thế đầu tiên khá ổn, doanh nhân người Anh còn tìm ra một giải pháp triệt để hơn là thành lập hãng bay mới.Ngày hôm sau, Branson gọi điện cho Boeing và nói: ""Tôi vừa có một trải nghiệm tồi vào ngày hôm qua khi bị hủy chuyến và tôi đang nghĩ đến việc mở một hãng hàng không mới tên là Virgin. Bên bạn có chiếc 747 cũ nào để bán cho tôi không?"".Và những gì xảy ra sau đó đã trở thành lịch sử. Ngay sau cuộc gọi, RJ Wilson, một đại diện của Boeing đã liên lạc để gặp và thảo luận về tham vọng của Branson về hãng hàng không mới.Ban đầu, Wilson không ấn tượng lắm với cái tên Virgin nhưng sau đó, ông đã bị thuyết phục và đồng ý cho Branson thuê một chiếc 747 cũ trong 1 năm để bắt đầu hoạt động kinh doanh hàng không của mình.Ngày nay, khi nhớ lại kỷ niệm về Virgin Atlantic, vị tỷ phú người Anh giãi bày: ""Tôi cho rằng sự cố hủy chuyến và sự ủng hộ của Wilson là hai điều quan trọng nhất góp phần vào sự ra đời và thành công của Virgin. Chúng tôi đã vượt qua cả những hãng hàng không lớn khác với hàng trăm chiếc máy bay và đội bay chuyên nghiệp để trở thành hãng hàng không lớn thứ 2 của Anh sau hơn 30 năm kể từ khi ra mắt"".Virgin Atlantic là hãng hàng không lớn thứ 2 của Anh.Tài sản ròng của Branson ước tính khoảng 4,1 tỷ USD, giúp ông trở thành người giàu thứ 8 nước Anh. Tập đoàn Virgin do ông điều hành hiện có hơn 60 công ty tại 35 quốc gia với gần 70.000 nhân viên trên toàn thế giới. Tháng 7 vừa qua, Branson đã bước sang tuổi 69. Vốn nổi tiếng với triết lý ""Mặc kệ nó, làm tới đi"", doanh nhân tỷ phú này dường như không có dấu hiệu dừng lại và sẽ tiếp tục dấn thân vào thử thách mới trong tương lai.Tỷ phú Richard Branson: Khởi nghiệp cũng giống như làm cha","thuê máy bay,ý tưởng kinh doanh,hãng hàng không,doanh nhân thành đạt",31-12-2019  00:00:00

20191231101542232,http://cafef.vn/canh-bao-bong-bong-cong-nghe-tu-warren-buffett-nhat-ban-20191231101542232.chn,6,1,"Cảnh báo bong bóng công nghệ từ ""Warren Buffett Nhật Bản""",31-12-2019,"Thật khó tìm ra một nhà đầu tư mà phải trải qua một năm tồi tệ hơn những gì ""Warren Buffett của Nhật Bản"" đã gặp phải.","Masayoshi Son sở hữu biệt danh ""Warren Buffett Nhật Bản"" trong thời gian từ 2000 đến 2014, khi mà ông chủ của SoftBank thực hiện một trong những vụ đầu tư giá trị mang tính táo bạo nhất trong lịch sử hiện đại: 19 năm trước, ông trao 20 triệu USD cho một giáo viên tiếng Anh ở Hàng Châu, Trung Quốc, để rồi khi Jack Ma chính thức đưa cổ phiếu Alibaba lên sàn vào năm 2014, Son đã gặt hái được lợi nhuận 1000%.Quỹ Vision Fund trị giá 100 tỷ USD mà Son đã triển khai trong năm 2016 là công cụ để thực hiện mục đích không chỉ nhằm tạo ra nhiều phi vụ lớn như Alibaba, mà còn giúp mở rộng quy mô cho những startup non trẻ. Tuy nhiên, những nỗ lực đó đang tạo ra nhiều ""quả bom xịt"" hơn là những chiến tích lẫy lừng. Những vụ bê bối từ WeWork, Uber, Lyft, Slack và những công ty khác liên tiếp xuất hiện. Nó đã dẫn đến khoản lỗ 6,4 tỷ USD cho SoftBank Group trong quý III.Bây giờ mọi lỗi lầm đều đổ dồn về phía Son. SoftBank hiện đang gặp khó khăn trong việc huy động 100 tỷ USD cho Vision Fund 2. Hóa ra, các nhà hảo tâm ban đầu của ông, bao gồm Ả Rập Xê Út, thường ít có xu hướng mở hầu bao khi những khủng hoảng xuất hiện ngày một nhiều thêm. Theo báo cáo của Sunday Telegraph, quỹ thứ hai có thể gọi được số vốn ít hơn 30% so với dự kiến ban đầu.Tuy nhiên, ngay cả điều đó cũng có thể là một sự lạc quan khi nền kinh tế toàn cầu và thị trường có thể phải chứng kiến nhiều sự hỗn loạn vào năm 2020.Son cần tự xem xét lại chính mình. Sự bùng nổ thanh khoản mà các công ty mới khởi nghiệp từ Hàng Châu đến Thung lũng Silicon đã khai thác để tăng trưởng và mở rộng quá mức đã tạo nên bong bóng trên toàn cầu. Xu hướng bội chi cho cổ phần trong các công ty khởi nghiệp của Son đã trở thành huyền thoại. Son đã trở thành một ""ngân hàng"", giúp gia tăng mạnh mẽ nguồn vốn cho các công ty khởi nghiệp.Dù không được dự tính từ trước, song những bong bóng từ chiến thuật đầu tư của Son mà được thổi phồng trong ba năm qua đã giúp thúc đẩy các chính sách lãi suất cực thấp từ Washington đến Tokyo. Điều đó làm trầm trọng thêm một làn sóng của sự kiêu ngạo và rủi ro đạo đức đã không xuất hiện kể từ cuối những năm 1990. Nó cũng giải thích tại sao giá tài sản ở New York, Tokyo và các nơi khác đang bùng nổ bất chấp cuộc chiến thương mại của Tổng thống Mỹ Donald Trump, và những lo ngại về sự tăng trưởng trong năm 2020.Tất cả điều này có nghĩa là khi những tính toán thực sự xảy ra, nó sẽ trầm trọng hơn bao giờ hết. Nó có thể đến khi các ngân hàng trung ương từ chối tiếp tục rót tiền vào ""những quả bom xịt"". Những ước tính đó cũng có thể xảy ra khi các nhà đầu tư thực sự nhìn nhận rõ ràng về nguy cơ suy giảm toàn cầu vào năm 2020. Năm năm qua đã chứng kiến sự mở rộng mang tính đồng bộ hiếm có, một điều được cho là đã trải qua vào giữa những năm 1990. Nhưng đó cũng chính là tiền đề cho thảm họa dot-com xảy ra vào cuối thập kỷ đó.Kể từ khi nắm quyền tại Quỹ Tiền tệ Quốc tế vào tháng 10, Giám đốc điều hành Kristalina Georgieva đã cảnh báo về ""một sự chậm lại mang tính đồng bộ"" khi cuộc chiến thương mại làm giảm lực cầu trên toàn thế giới.Tuy nhiên, ngay cả quan điểm đó cũng được khẳng định dựa trên các giả định rằng hai nhà lãnh đạo Donald Trump và Tập Cận Bình sẽ đình chiến. Điều đó vẫn là một ẩn số lớn. Mặc dù hai bên dường như đang tiến tới ""thỏa thuận giai đoạn một"", giai đoạn hai liên quan đến hàng rào phi thuế quan của Bắc Kinh và các khoản trợ cấp doanh nghiệp mới là điều đáng để quan tâm.Có một cuộc tranh luận nổ ra về việc liệu Son có nên tạm gác lại Vision Fund 2.0 và tập trung vào một mục tiêu duy nhất để mang lại lợi nhuận cao nhất có thể. Sự thất bại của WeWork là lời nhắc nhở đối với Son về việc việc để tâm đến mức lợi nhuận và vấn đề quản trị ở những công ty phát triển hàng đầu. Vừa qua, SoftBank đã phải cam kết đầu tư 38 tỷ USD tiền của chính mình cho quỹ thứ hai.Lý do cho tất cả những vấn đề này là nằm những tính toán sai lệch của SoftBank về giá trị của các công ty khởi nghiệp trong 20 năm qua. Điều đã cứu sống Son sau thảm họa giai đoạn cuối thập niên 90/đầu thập niên 2000 là sự đặt cược khôn ngoan vào Alibaba và Yahoo Nhật Bản. Tần suất của những thắng lợi đó ngày càng giảm dần. Vào tháng 8 năm 2018, Son đã gọi WeWork là ""Alibaba tiếp theo"". Nhưng điều đó ngày càng không đúng.Tham khảo ForbesMasayoshi Son - Ông trùm cướp bóc thế kỷ 21?","Masayoshi Son,Softbank,Wework",31-12-2019  00:00:00

20191231094533248,http://cafef.vn/cuu-chu-tich-toi-do-cua-nissan-da-roi-nhat-20191231094533248.chn,6,1,"Cựu chủ tịch ""tội đồ"" của Nissan đã rời Nhật",31-12-2019,"Theo tin từ các hãng truyền thông, Carlos Ghosn, người đang bị quản thúc tại Nhật để chờ xét xử với cáo buộc gian lận tài chính, đã rời khỏi nước này và bay tới Lebanon...","Theo tin từ hãng truyền thông Pháp Les Echos, Carlos Ghosn, cựu chủ tịch bị bắt của hãng xe Nissan, đã bay tới Lebanon vào tối ngày 30/12. Trước đó, ông đang bị quản thúc tại Tokyo để chờ phiên toà xét xử với các cáo buộc gian lận tài chính. Tờ báo này dẫn tin từ một nguồn thân cận và tin tức từ tờ L'Orient-Le Jour của Lebanon. Trong đó, thông tin về việc liệu Ghosn đã đạt một thoả thuận với các công tố viên để rời Nhật hay được thả tự do chưa được tiết lộ.Tờ Financial Times cũng dẫn nguồn thân cận từ gia đình của Ghosn cho biết ông đã có mặt ở Lebanon. Hiện luật sư của Ghosn chưa đưa ra bình luận về thông tin này, nhưng một người thân cận với ông cho biết ông đã có mặt ở Beirut, Lebanon vào ngày thứ hai.Hãng truyền thông NHK của Nhật cho biết đã liên lạc với đội ngũ pháp lý của Ghosn nhưng luật sư của ông nói rằng không biết liệu ông đã rời Nhật hay chưa và sẽ xác nhận lại nếu thông tin này là chính xác. Theo NHK, các công tố viên cũng nói rằng họ không biết việc Ghosn đã rời lãnh thổ Nhật và sẽ tìm cách xác nhận thông tin này.Theo Reuters, người phát ngôn của phòng công tố Tokyo không đưa ra bình luận về thông tin này. Còn người phát ngôn của Nissan tại Tokyo từ chối đưa ra bình luận.Hiện tại, chưa rõ bằng cách nào mà Ghosn, người có hộ chiếu Pháp và Lebanon, rời khỏi Nhật bằng cách nào, khi mà ông đang chịu quản thúc chặt chẽ bởi toà án.Ghosn bị bắt tại Tokyo vào cuối năm 2018 sau khi Hiroto Saikawa, CEO của Nissan lúc đó, cáo buộc ông và một giám đốc khác có một loạt hành vi gian lận tài chính. Sau đó, Ghosn bị sa thải khỏi vị trí chủ tịch của hãng xe Nhật.Tháng 9 năm nay, ông Saikawa đột ngột từ chức sau khi một cuộc điều tra nội bộ phát hiện rằng ông cũng nhận một khoản thưởng bất thường vào năm 2013.Trong bản tóm tắt cuộc điều tra nội bộ công bố vào tháng 9, Nissan cáo buộc Ghosn và cựu giám đốc Greg Kelly che giấu khoản chi trả 327 triệu USD cho mình và một số giám đốc khác. Trong đó, 187 triệu USD là tiền thưởng không được công bố và 140 triệu USD là các chi tiêu bất hợp lý.Cũng là người điều hành hãng xe Pháp Renault và liên minh ôtô Nissan-Renault-Mitsubishi, Ghosn bị sa thải khỏi tất cả các vị trí này và chờ xét xử tại Nhật.Theo nguồn tin của tờ Financial Times, Ghosn không còn chịu quản thúc tại gia ở Tokyo nữa, nhưng không rõ ông đã được thả ra hay đạt được một thoả thuận với các công tố. Dẫn nguồn tin thân cận với Ghosn, tờ này cho biết ông đã hạ cánh xuống sân bay quốc tế Rafic al-Hariri của Beirut vào tối muộn ngày Chủ nhật (giờ địa phương).Các luật sư của Ghosn đã yêu cầu toà án bác bỏ mọi cáo buộc chống lại ông. Họ cho rằng các công tố viên thông đồng với quan chức chính phủ và ban giám đốc của Nissan để đuổi Ghosn ra khỏi công ty, nhằm ngăn chặn một thương vụ sáp nhập với Renault.Sau khi bị bắt, Ghosn bị giam giữ trong một thời gian dài, nhưng gần đây đã được bảo lãnh tại ngoại với những điều khoản nghiêm ngặt yêu cầu ông không được rời Nhật Bản.Hồi tháng 9, Ghosn đạt được một thoả thuận với Uỷ ban Chứng khoán Mỹ (SEC) về cáo buộc khai báo sai thông tin tài chính, nộp phạt dân sự 1 triệu USD và chấp nhận lệnh cấm làm giám đốc tại một công ty niêm yết trong 10 năm.Trước đó, SEC cáo buộc Ghosn cùng một số người khác che giấu hơn 140 triệu tiền thưởng và trợ cấp hưu trí của mình. Nissan cũng phải nộp phạt dân sự 15 triệu USD sau khi SEC cáo buộc hãng này vi phạm quy định chống gian lận. Cả hai vụ việc đều được thoả thuận mà các đương sự không thừa nhận hay phủ nhận cáo buộc. Ngoài niêm yết tại sàn chứng khoán Tokyo, cổ phiếu Nissan hiện cũng giao dịch trên sàn OTC của Mỹ.Nissan triệu hồi 1,2 triệu ô tô tại Mỹ","cựu chủ tịch,hãng truyền thông,người thân cận,công tố viên",31-12-2019  00:00:00

2019123109562417,http://cafef.vn/chung-khoan-rong-viet-toc-do-giai-ngan-von-dau-tu-cong-vao-hang-khong-cao-toc-nhiet-dien-va-ha-tang-sea-games-se-tang-manh-trong-nam-2020-2019123109562417.chn,7,1,"Chứng khoán Rồng Việt: Tốc độ giải ngân vốn đầu tư công vào hàng không, cao tốc, nhiệt điện và hạ tầng Sea Games sẽ tăng mạnh trong năm 2020",31-12-2019,"Theo báo cáo Chiến lược đầu tư với tựa đề ""Cơ hội lớn thường đến trong những thời điểm khó khăn"" của Công ty CP Chứng khoán Rồng Việt, quy mô vốn đầu tư công có thể giải ngân năm 2020 lên tới 500 nghìn tỷ, tăng 16% so với cùng kỳ so với dự toán 2019.","Theo báo cáo Chiến lược đầu tư với tựa đề ""Cơ hội lớn thường đến trong những thời điểm khó khăn"" của Công ty CP Chứng khoán Rồng Việt, trong bối cảnh chính sách tiền tệ có nhiều ràng buộc, chính sách tài khóa sẽ đóng vai trò quan trọng hơn trước. Các năm qua, quá trình giải ngân vốn đầu tư công chậm chạp trong đó chính sách và luật pháp là một trong những yếu tố cốt lõi. Từ năm 2020, nhóm nghiên cứu của báo cáo cho rằng tốc độ giải ngân vốn đầu tư công sẽ bắt đầu tăng mạnh trở lại tại 04 lĩnh vực chính gồm: (1) Đường cao tốc, 2) Sân bay, 03) Nhiệt điện và 04) Hạ tầng chuẩn bị cho Sea Games 31. Quy mô vốn đầu tư công có thể giải ngân năm 2020 lên tới 500 nghìn tỷ, tăng 16% so với cùng kỳ so với dự toán 2019.2020 là năm cuối cùng trong kế hoạch đầu tư công trung hạn 2016-2020 do Quốc hội đề ra. Ngay từ tháng 1/2020, Luật đầu tư công sửa đổi sẽ chính thức có hiệu lực và được kỳ vọng sẽ giải quyết những điểm nghẽn trong quá trình giải ngân vốn đầu tư công.Sự kiện khởi công các cấu phần đầu tiên của đại dự án Cao tốc Bắc Nam trong tháng 9 vừa qua được xem như điểm khởi đầu cho thời kỳ nâng cấp cơ sở hạ tầng trên quy mô lớn tại Việt Nam. Bên cạnh việc tái khởi công các dự án giao thông đường bộ trọng điểm đang bị chậm trễ, dự án cao tốc Bắc-Nam và sân bay Long Thành sẽ lần lượt được khởi công xây dựng trong 2 năm tới đây.Dự án Cao tốc Bắc-Nam, xương sống trong hệ thống giao thông đường bộ của Việt Nam, sẽ kết nối và mang cơ hội phát triển tới các tỉnh/thành phố trên dải đất miền Trung. Tổng quy mô dự án đạt khoảng 5 tỷ USD, trong đó 3/11 tuyến đường/đoạn sử dụng vốn Ngân sách Nhà nước (NSNN) đã và sẽ được triển khai trong quý 4/2019. Phần còn lại dự kiến sẽ dần triển khai từ quý 2/2020 theo hình thức PPP. Từng tuyến đường/đoạn dự kiến hoàn thành trong 18 tháng kể từ thời điểm khởi công.Điểm nổi bật trong dự án Cao tốc Bắc-Nam gắn với việc Bộ giao thông vận tải công bố hủy đấu thầu quốc tế và chuyển sang đấu thầu trong nước. Với quy mô tổng mức đầu tư các dự án theo hình thức PPP trong cao tốc Bắc-Nam lên tới 4 tỷ USD, đây thực sự là cơ hội lớn cho các doanh nghiệp trong nước.Đi kèm với đó là thách thức huy động vốn cho dự án. Hiện tại, tìm nguồn vốn tín dụng cho các dự án đầu tư đường cao tốc vẫn đang là bài toán hóc búa do các ngân hàng thận trọng hơn cùng với những vướng mắc về cơ chế đầu tư công-tư (PPP) chưa hoàn toàn được giải quyết. Tuy nhiên, những nỗ lực gần đây từ phía nhà điều hành giúp huy động gần 9.000 tỷ đồng vốn tín dụng cho dự án cao tốc Trung Lương – Mỹ Thuận và Hữu Nghị - Chi Lăng đã phát đi tín hiệu đảm bảo cung ứng đủ vốn cho các dự án trọng điểm của quốc gia.Để chia lửa cho hệ thống tín dụng trong nước, mới đây IFC nhận được sự ủng hộ từ Bộ Tài Chính về kế hoạch phát hành trái phiếu Bông Sen, trái phiếu tiền đồng của IFC, ra thị trường quốc tế nhằm huy động vốn cung cấp cho các doanh nghiệp trong nước mà không phải lo về tỷ giá.Sau khi thu hút được toàn ông lớn như Samsung, Foxconn, Canon,... Bắc Ninh đòi hỏi gì ở nhà đầu tư nước ngoài với tiêu chí ""2 ít, 3 cao""?","Chứng khoán Rồng Việt,tốc độ giải ngân,đầu tư công,chiến lược đầu tư",31-12-2019  00:00:00

