id,url,category_id,publisher_id,title,pubDate,description,content,tags,crawlDate
20191230171700951,http://cafef.vn/biet-thu-dao-ecopark-grand-the-island-kien-tao-chuan-song-wellness-20191230171700951.chn,3,1,Biệt thự đảo Ecopark Grand – The Island kiến tạo chuẩn sống wellness,30-12-2019,Health over Wealth (sức khoẻ quan trọng hơn tài sản) là khái niệm ngày càng lan tỏa. Thị trường bất động sản tích hợp các tiện ích hướng đến mục tiêu chăm sóc sức khoẻ (welness real estate) cũng đang dịch chuyển theo xu hướng này.,"Kỷ nguyên bất động sản wellness     Khái niệm bất động sản wellness gắn với các không gian sống và làm việc được thiết kế với mục tiêu chú trọng vào sức khỏe thể chất và tinh thần. Chính vì thế, tính bền vững trong xây dựng cũng như môi trường sống được đặt lên hàng đầu.      Các yếu tố như ánh sáng tự nhiên, chất lượng không khí, âm thanh, sự kết nối, giao hòa với không gian xanh cùng các tiện ích phục vụ nhu cầu nâng cao sức khỏe – từ các tiện ích phổ biến như hồ bơi, phòng gym, sân tennis, các chương trình nâng cao thể chất tùy biến cho hộ gia đình như hỗ trợ tư vấn dinh dưỡng, tư vấn giảm cân, các lớp học yoga, thiền… bên cạnh các nhà hàng phục vụ món ăn hữu cơ cho đến nhà hàng phục vụ món ăn hữu cơ đang được các nhà phát triển bất động sản nghiên cứu và áp dụng.     Với mục tiêu đặt sức khỏe của con người làm trọng tâm hình thành, thiết kế, sáng tạo và tái phát triển không gian sống, bất động sản wellness đang trở thành xu hướng bùng nổ trong thời gian tới.          Theo báo cáo Build Well to Live Well: Wellness Lifestyle Real Estate and Communities của tổ chức phi lợi nhuận Global Wellness Institute, thị trường bất động sản tích hợp các tiện ích hướng đến mục tiêu chăm sóc sức khoẻ (welness real estate) hiện có giá trị 134 tỷ USD và ước tính sẽ tăng lên 180 tỷ USD vào năm 2022 – tức chiếm 50% so với ngành công nghiệp xây dựng ""xanh"" trên toàn cầu.      Ecopark Grand - The Island dẫn đầu xu thế bất động sản wellness tại Việt Nam     Trước nhu cầu đang ngày càng gia tăng về các tiện ích chăm sóc sức khỏe, một số đơn vị phát triển bất động sản cao cấp tại Việt Nam đã nhanh chóng nắm bắt xu hướng này để thu hút lớp cư dân thượng lưu. Ecopark Grand - The Island, dự án biệt thự đảo tên tuổi tại thị trường phía Bắc với không gian sinh thái, mang đến trải nghiệm sống đáng nhớ về một cuộc sống bình yên, tự tại giữa sông nước, cỏ cây là dự án như vậy.     Lấy cảm hứng từ Đảo Cọ kỳ vĩ ở Dubai, nơi được mệnh danh là ""Kỳ quan thứ 8 của thế giới"", Ecopark Grand - The Island được xây trên những nhánh đảo nhô ra giữa vịnh hồ xanh mát. Từ trên cao nhìn xuống, khu biệt thự đảo sẽ khiến bạn liên tưởng đến một thế giới siêu thực trong bộ phim giả tưởng The Island của đạo diễn Michael Bay, một hòn đảo lý tưởng, nơi được cách ly hoàn toàn với thế giới ồn ào và ô nhiễm.          Với mục tiêu tạo dựng một không gian sống lý tưởng đúng chuẩn wellness, biệt thự Ecopark Grand – The Island được thiết kế theo cách đặc biệt nhằm tận dụng tối đa yếu tố thiên nhiên, trong đó, nước là yếu tố hồn cốt, giúp tạo ra sự liền mạch giữa không gian bên trong và bên ngoài. Có thể nói, bên cạnh mảng xanh và nước vốn là hai yếu tố cốt lõi tạo nên nét đặc biệt cho quần thể biệt thự đảo với tỷ lệ không gian mặt nước và cây xanh chiếm tới 62%, thiết kế thông minh cũng đóng một vai trò hết sức quan trọng.     Đây thực sự là không gian sống đẳng cấp hài hoà giữa thiên nhiên được vẽ nên bởi gam màu xanh bất tận của cỏ cây và thảm tầng thực vật trải dài ngút mắt, những giàn tường vi e ấp trước cửa nhà, những rặng dừa rủ bóng hay những vườn cẩm tú cầu quyến rũ, kiêu sa. Ở đó, bạn sẽ đón những tia nắng mai tinh khôi với ly cà phê pha đúng điệu bên khung cửa sổ rộng mở hướng ra mặt hồ trong veo hay tận hưởng những phút giây tĩnh lặng giữa hoàng hôn tím biếc.          Hệ thống mặt nước chảy qua biệt thự đảo được thiết kế bởi 3 công ty lớn đến từ Singapore, Mỹ, Úc và Nhật. Hệ thống mặt nước theo kiểu giật cấp từ thấp đến cao, cao nhất là khu Làng Việt, sau đó đến đảo, rồi vịnh Aqua bay và thấp nhất là khu vực sân golf 18 hố, nước sẽ tự động chảy từ cao đến thấp và sau đó được bơm ngược trở lại bằng hệ thống bơm ngầm về khu  xử lý nước bên cạnh khu Làng Việt.     Các đặc quyền về tiện ích và dịch vụ xứng tầm giúp nâng cao sức khoẻ cho cư dân cũng được chủ đầu tư đặc biệt chú trọng trong nỗ lực hòa hợp yếu tố Ecology và Economy. Không gian clubhouse rộng hơn 7.000 m2 vươn ra mặt hồ với đầy đủ các tiện ích hạng sang như phòng thử rượu, bussiness lounge thượng hạng, bến du thuyền, lầu vọng thủy, bể bơi vô cực ngoài trời 4 mùa, phòng gym, spa, sauna; ca-nô hiện đại phục vụ di chuyển và tham quan nội khu biệt thự đảo; đội ngũ nhân viên concierge sẵn sàng phục vụ 24/7 hay đặc quyền được phục vụ tại nhà khi cần ""thửa"" những món đồ xa xỉ trong bộ sưu tập phiên bản giới hạn của các thương hiệu trứ danh như LVMH, Bvlgari, Tumi…      Tất cả đều được ""đo ni đóng giày"" để mang đến cho cư dân những trải nghiệm khó quên về một cuộc sống sang trọng nhưng đảm bảo sức khoẻ cả về thể chất lẫn tinh thần theo một cách rất riêng của cộng đồng wellness mang tên Ecopark Grand – The Island.","không gian sống,bất động sản",31-12-2019  00:00:00

20191230150520638,http://cafef.vn/5-thach-thuc-doi-voi-thi-truong-bat-dong-san-viet-nam-20191230150520638.chn,3,1,5 thách thức đối với thị trường bất động sản Việt Nam,30-12-2019,"Năm 2019 được xem là năm đầy biến động của thị trường bất động sản, bên cạnh các cơ hội thì thị trường bất động sản Việt Nam đang đối diện với không ít thách thức.","Ông Nguyễn Trần Nam, Chủ tịch Hiệp hội BĐS Việt Nam chỉ ra 5 thách thức đối với thị trường BĐS. Đây cũng là những thách thức mà nhiều chuyên gia trong ngành đã chỉ ra trong suốt thời gian qua.Một là, hệ thống các văn bản pháp lý liên quan đến thị trường bất động sản còn chưa đồng bộ. Hành lang pháp lý điều chỉnh thị trường bất động sản, từ công tác đầu tư xây dựng, giao dịch đến quản lý sử dụng bất động sản chậm được hoàn thiện, còn chồng chéo; nhiều vấn đề phát sinh từ thực tiễn, bất cập của cơ chế chính sách nhưng chưa được bổ sung, sửa đổi kịp thời dẫn đến thị trường bất động sản chưa được quản lý và kiểm soát một cách hiệu quả. Thị trường đang phải đối mặt với nhiều khó khăn khi phải chờ đợi nhiều bộ Luật, văn bản liên quan trong giai đoạn điều chỉnh, hoàn thiện như Luật Quy hoạch, Đất đai, Nhà ở, Xây dựng, kinh doanh BĐS vv và vv ... Các xung đột, chồng chéo đã hạn chế các tác động tích cực trong thực thi các đạo luật, tạo ra cản trở trong quá trình thực thi trên thực tế, phát sinh chi phí lớn và rủi ro cao đối với các doanh nghiệp và nhà đầu tư.   Hai là, những khó khăn về thủ tục hành chính và những sức ép lớn từ chủ trương kiểm soát chặt chẽ hơn việc cấp phép dự án mới. Việc các cơ quan chức năng chậm phê duyệt cấp phép xây dựng dự án hay tạm dừng dự án đang triển khai để rà soát, kiểm tra… là nguyên nhân dẫn đến giảm nguồn cung, kéo theo lượng giao dịch bất động sản cũng giảm. Mặt khác, công tác quy hoạch, đền bù, phê duyệt dự án… đều bị siết chặt trong khi nhu cầu triển khai dự án của nhà đầu tư lại rất cao. Điều này đã từng được Thủ tướng Chính phủ nhắc nhở việc các cơ quan quản lý Nhà nước còn có hiện tượng né trách nhiệm, dẫn đến sự chậm trễ trong việc phê duyệt, triển khai dự án và thu hút đầu tư.   Trong thời gian vừa qua việc tiếp cận đất đai cho các dự án kinh doanh bất động sản gặp nhiều khó khăn. Bên cạnh đó, điều kiện nhận chuyển nhượng quyền sử dụng đất khi thực hiện dự án nhà ở cũng còn nhiều vướng mắc. Chính sách bồi thường, giải phóng mặt bằng còn nhiều bất cập, là lĩnh vực xảy ra nhiều khiếu kiện nhất trong thời gian qua. Việc xác định tiền sử dụng đất đối với các dự án bất động sản mỗi địa phương mỗi khác.   Ba là, doanh nghiệp bất động sản gặp khó khăn trong tiếp cận nguồn vốn. Hiện nay, hoạt động tín dụng của ngân hàng đối với lĩnh vực kinh doanh bất động sản đang bị thắt chặt. Cụ thể: Lãi suất tiếp tục cao (lãi suất huy động lên 8,7%, cộng thêm biên độ 3% thì lãi suất cho vay lên đến 11 – 12%); nguồn vốn ngắn hạn cho vay trung và dài hạn tiếp tục giảm từ 45% xuống 40%, hệ số rủi ro đối với các khoản cho vay bất động sản tăng từ 150% lên 200%… khiến cho ngân hàng phải cẩn trọng hơn trong việc cho vay kinh doanh bất động sản. Dòng vốn hạn chế cũng khiến các nhà đầu tư cũng cẩn trọng khi đầu tư vào lĩnh vực bất động sản. -  Thứ tư là, gần đây, tái xuất hiện tình trạng phân lô bán nền tràn lan và các đợt sốt ảo giá đất tại một số địa phương, tình trạng lừa đảo bán “dự án ma” trở nên phổ biến. Nhiều nơi diễn ra tình trạng mua bán, chuyển nhượng nhà, đất khi chưa đáp ứng đầy đủ điều kiện, cơ sở pháp lý. Việc phân lô bán nền không giải quyết được sự tích đọng cho quy mô của nền kinh tế mà còn tạo ra sự lệch lạc về quy hoạch cũng như gây ra ách tắc giao thông, gây ra sự lộn xộn lớn cho bộ mặt đô thị.   Năm là, thiếu hụt hệ thống thông tin về thị trường bất động sản và những lo ngại về tính minh bạch của thị trường. Việt Nam đã, đang hội nhập sâu rộng vào nền kinh tế quốc tế và khu vực, kỳ vọng sẽ gia tăng thu hút vốn FDI vào Việt Nam, trong đó có lĩnh vực bất động sản. Tuy nhiên, các nhà đầu tư nước ngoài cũng rất coi trọng việc so sánh lợi ích giữa đầu tư vào thị trường bất động sản Việt Nam và các quốc gia khác trong khu vực như: Indonesia, Singapore, Hong Kong (Trung Quốc)… Ở thị trường bất động sản Việt Nam, tính minh bạch thông tin chưa cao đã gây cản trở quá trình đầu tư của các nhà đầu tư nước ngoài vào thị trường. Nguyên nhân của tình trạng trên chủ yếu là do chậm thực hiện các giải pháp nhằm minh bạch hóa thị trường  bất động sản, kích thích đầu tư. Cụ thể là xây dựng hệ thống cơ sở dữ liệu quốc gia thông tin về việc đăng ký và thực hiện các giao dịch bất động sản.  Ba nơi có giá nhà đất tăng phi mã ở Tp.HCM khiến người dân đuổi theo “đứt hơi”","thị trường bất động sản,BĐS Việt Nam,bất động sản",31-12-2019  00:00:00

20191230171608279,http://cafef.vn/nao-vet-cat-xen-48600-m2-xay-khu-cao-oc-lan-bien-o-quy-nhon-20191230171608279.chn,3,1,"Nạo vét, cắt xén 48.600 m2 xây khu cao ốc lấn biển ở Quy Nhơn",30-12-2019,"Ngày 30/12, UBND tỉnh Bình Định cho biết đã có quyết định phê duyệt nội dung báo cáo đánh giá tác động môi trường đối với dự án khu Mũi Tấn (phường Hải Cảng, TP Quy Nhơn) của Công ty CP dịch vụ giải trí Hưng Thịnh Quy Nhơn.","Theo đó, dự án khu Mũi Tấn có tổng diện tích xây dựng là hơn 73.000 m2, gồm tòa nhà 40 tầng nổi (với khu khách sạn 467 phòng và khu căn hộ có 1.646 căn), tuyến kè với tổng chiều dài là 1.493,10 m. Tổng diện tích nạo vét, cắt xén khu lấn biển là 48.600 m2. Bùn nạo vét từ dự án này được chủ đầu tư tiến hành vận chuyển đến nơi khác để tận dụng san lấp mặt bằng.Năm 2013, UBND tỉnh Bình Định đồng ý cho một doanh nghiệp san lấp lấn biển tại khu vực Mũi Tấn với diện tích hơn 12ha, chiếm 1km bờ biển Quy Nhơn để làm cáp treo phục vụ du lịch. Khu lấn biển Mũi Tấn. Ảnh: Trương Định Tuy nhiên, sau khi san lấp, nhà đầu tư không thực hiện dự án cáp treo khiến khu đất bị bỏ hoang suốt 6 năm qua. Nguyên nhân là chủ đầu tư muốn xây dựng biệt thự tại khu lấn biển này nhưng lãnh đạo tỉnh Bình Định không đồng ý và yêu cầu chủ đầu tư chỉ làm dịch vụ tại đây.Theo quy hoạch mới, UBND tỉnh Bình Định giao Công ty CP dịch vụ giải trí Hưng Thịnh Quy Nhơn làm các thủ tục tiếp theo để triển khai đầu tư xây dựng.Tiềm năng đầu tư bất động sản ven biển Quy Nhơn","tỉnh bình định,tác động môi trường,TP Quy Nhơn,dịch vụ giải trí,chủ đầu tư,san lấp mặt bằng,biển Quy Nhơn",31-12-2019  00:00:00

20191230144856513,http://cafef.vn/doc-dao-ngoi-nha-o-ha-noi-nang-chieu-moi-noi-trong-nha-ma-khong-khac-gi-ngoai-troi-20191230144856513.chn,3,1,"Độc đáo ngôi nhà ở Hà Nội nắng chiếu mọi nơi, trong nhà mà không khác gì ngoài trời",30-12-2019,"Căn nhà này ban đầu mang phong cách tân cổ điển, không phù hợp với khí hậu nhiệt đới và nằm ở vị trí bên cạnh ngã ba sông.","Dự án này là một căn hộ tại Long Biên, Hà Nội được cải tạo lại với diện tích 468 m2.Căn nhà này ban đầu mang phong cách tân cổ điển, có diện tích dài nhưng mà hẹp, được chia thành các phần khá giống nhau.Tình trạng ban đầu của nó không phù hợp với khí hậu nhiệt đới và nằm ở vị trí bên cạnh ngã ba sông.Những điều chỉnh đáng kể mà nhóm thiết kế thực hiện là tạo ra mái hiên, mở rộng phía sau và tạo ra một khoảng trống ở trung tâm của căn biệt thự.Các khu vực công cộng của ngôi nhà được bố trí ở tầng 1.Tầng 2 có phòng ngủ. Tầng 3 được mở rộng và có thể nhìn ra khu vườn và dòng sông.Mái hiên và khoảng trống tạo ra không gian trống, quan trọng hơn là thích nghi với khí hậu nhiệt đới.Cảm nhận được gió, mưa và thiên nhiên là một trải nghiệm lý tưởng khi đứng dưới mái hiên.Cây cối, sỏi được đặt ở nhiều nơi, bao gồm khoảng trống ở tầng 1 cho đến các tầng ở phía trên và khu vực gần nhà tắm.Cửa trượt, cửa sổ và giếng trời giúp điều hòa thông gió.Cửa sổ bê tông, cửa gỗ cho ánh sáng xuyên qua - diễn tả sự chuyển động của bóng mặt trời. Nó cũng làm giảm nhiệt đồng thời giữ sự riêng tư.Các đồ nội thất được làm từ vật liệu tự nhiên, gỗ tự nhiên, đá ong và sơn trắng.Mặt tiền được đơn giản hóa để phù hợp với các biệt thự khác trong khu vực cũng như vẫn đảm bảo được sự tinh tế và thanh lịch.Khoảng sân ở phía sau có một nơi nghỉ ngơi, hòa mình với cây cỏ và hồ bơi.Nơi này có thể sử dụng cho các bữa tối hoặc các bữa tiệc, mang lại sự thư giãn và thoải mái.Sau phục dựng, ngôi nhà truyền thống ở Củ Chi được so sánh với ốc đảo","Ngã Ba Sông,Đồ nội thất,gỗ tự nhiên,Nhà đẹp,thiết kế không gian,hồ bơi,đá tự nhiên,nhà tắm",31-12-2019  00:00:00

2019123017123981,http://cafef.vn/ngo-ngang-voi-nhung-cai-nhat-cua-bat-dong-san-tphcm-nam-2019-gia-re-nhat-the-gioi-dang-dau-tu-bac-nhat-chau-a-2019123017123981.chn,3,1,"Ngỡ ngàng với những cái nhất của bất động sản TP.HCM năm 2019: Giá rẻ nhất thế giới, đáng đầu tư bậc nhất châu Á!",30-12-2019,"Trong năm 2019, thị trường TPHCM được thế giới chú ý với hàng loạt những ""cái nhất"". Trong đó đáng chú ý nhất là thành phố có giá nhà rẻ bậc nhất thế giới, có triển vọng đầu tư bất động sản tốt nhất Châu Á và là nơi đáng sống thứ ba cho người nước ngoài trên thế giới.","Giá nhà ở TP.HCM trong nhóm rẻ nhất thế giới?Hồi giữa năm 2019, Công ty tư vấn CBRE đưa ra báo cáo giá nhà trung bình ở TP.HCM là 103.100 USD/căn, nằm trong nhóm những thành phố lớn có giá nhà rẻ nhất. Cụ thể, trong bản báo cáo Global Living Report, Công ty CBRE VN đã khảo sát giá nhà tại 35 TP lớn trên thế giới, trong đó TP.HCM nằm trong nhóm những TP lớn có giá nhà rẻ nhất thế giới với mức giá trung bình là 103.100 USD/căn (tương đương 2,4 tỉ đồng), trong khi ở Bangkok (Thái Lan) là 106.400 USD/căn, ở Kuala Lumpur (Malaysia) là 119.700 USD/căn và Singapore bình quân khoảng 874.400 USD/căn hộ.Với mức giá trên, TP.HCM xếp thứ 34/35 TP được khảo sát, chỉ đắt hơn Istanbul (Thổ Nhĩ Kỳ). Cũng theo CBRE VN, giá căn hộ cao cấp ở TP.HCM trung bình là hơn 403.000 USD/căn (tức hơn 9,3 tỉ đồng), trong khi ở Kuala Lumpur là 415.000 USD và ở Bangkok là 456.000 USD/căn. Tại Singapore, một căn hộ cao cấp giá khoảng 1,2 triệu USD.Là người có nhiều năm nghiên cứu thị trường Việt Nam và quốc tế đánh giá, so với các nước trong khu vực, Phó giám đốc điều hành Savills Việt Nam, Troy Griffiths cho rằng giá nhà ở Việt Nam khá thấp. Theo nghiên cứu của Savills đến cuối năm 2014, so sánh các phân khúc bất động sản trong khu vực châu Á Thái Bình Dương, Việt Nam có mức giá bán hoặc thuê thấp hơn so với nhiều nước khác.Nhưng theo ông, nghịch lý nằm ở chỗ, giá thấp hơn nhưng người dân không dễ dàng chi trả. Ông Troy Griffiths cho rằng tại Việt Nam ngay cả nhà thuộc phân khúc trung bình (rẻ, vừa túi tiền) vẫn nằm ngoài tầm với của rất nhiều người.Thêm nữa, rất khó để xác định khả năng chi trả cho bất động sản là nhà ở của người Việt Nam. Bởi lẽ, khái niệm này phụ thuộc vào nhiều yếu tố mang tính cá nhân. Bên cạnh lương, thu nhập, còn có sự tác động từ phía gia đình, đồng thời tính phổ dụng của hệ thống tín dụng ngân hàng tại Việt Nam còn ít hơn so với các nước khác.  Bất động sản TPHCM đứng đầu châu Á về triển vọng phát triển trong năm 2020Theo báo cáo khảo sát Emerging Trends mới công bố của Viện Đất đai Đô thị Mỹ (ULI) và PwC, Tp.HCM vượt Singapore để đứng đầu châu Á về triển vọng phát triển BĐS năm 2020 và đứng thứ ba về triển vọng đầu tư BĐS tại khu vực châu Á - Thái Bình Dương.  Khảo sát Emerging Trends được thực hiện với đánh giá của 460 chuyên gia về bất động sản. Tp.HCM là thị trường mới nổi duy nhất được đánh giá cao bởi các nhà đầu tư nhờ tăng trưởng kinh tế mạnh mẽ, chính trị ổn định, tốc độ đô thị hóa cao và được hưởng lợi từ sự tăng trưởng của ngành công nghiệp sản xuất.Báo cáo này cũng nhận định, thị trường BĐS tại TPHCM có triển vọng mạnh mẽ ở tất cả các phân khúc bán lẻ, văn phòng, khách sạn, căn hộ, BĐS công nghiệp. Trong khi báo cáo đưa ra lời khuyên nhà đầu tư nên bán danh mục đầu tư văn phòng, căn hộ tại Kuala Lumpur và Hong Kong, danh mục khách sạn tại Mumbai và Manila thì cũng khuyên nhà đầu tư nên mua tất cả những danh mục đầu tư này tại TPHCM.TP. Hồ Chí Minh lot top 3 nơi đáng sống cho người nước ngoài trên thế giớiInterNations đã công bố 30 thành phố tốt nhất để sống, làm việc và kết bạn vào năm 2020. TP. Hồ Chí Minh được xếp thứ 3 trong danh sách này, sau TP. Đài Bắc (Đài Loan, Trung Quốc) và thủ đô Kuala Lumpur (Malaysia). Đây là kết quả thu được sau khi InterNations thực hiện khảo sát 20.000 người để bình chọn và xếp hạng.Cụ thể, TP.HCM hội tụ đủ yếu tố để trở thành một điểm đến hoàn hảo cho người nước ngoài định cư và làm việc. Trong những năm qua, thành phố đã có nhiều chính sách nhằm cải thiện môi trường sống và thu hút dòng người nhập cư, làm việc lâu dài trên khắp thế giới.  Đáng chú ý, cuộc khảo sát riêng của Tập đoàn tài chính HSBC mới đây cũng gọi tên Việt Nam là một trong những quốc gia tốt nhất đối với người nước ngoài nếu muốn sinh sống và làm việc.Việc TP.HCM đứng thứ 3 trong bảng danh sách được InterNations công bố thực tế không phải là điều bất ngờ. Căn cứ vào khảo sát, nhiều người nước ngoài nhận xét TP.HCM ghi điểm bởi chi phí sinh hoạt thấp, tìm nhà dễ dàng và giao thông khá thuận lợi. Thêm vào đó, khí hậu dễ chịu cũng là một điểm cộng rất lớn.","bất động sản,đầu tư bất động sản,giá nhà ở,Giá nhà trung bình,giá căn hộ,căn hộ cao cấp,nghiên cứu thị trường",31-12-2019  00:00:00

